{"$id":"https://museum-codex.example/schemas/art/release/relationship-explorer-config-v190.schema.json","$schema":"https://json-schema.org/draft/2020-12/schema","additionalProperties":true,"properties":{"algorithm":{"const":"focused_relation_lanes_v1"},"context_source":{"type":"object"},"default_global_graph_node_count":{"const":0},"default_mode":{"const":"choose_artist"},"default_nodes":{"const":[]},"distance_semantics":{"const":"none"},"focus_expanded_node_limit":{"const":20},"focus_initial_neighbor_limit":{"const":12},"focus_initial_per_lane_limit":{"const":4},"lane_order":{"const":["shared_subject","shared_material","shared_technique"]},"node_size_semantics":{"const":"constant"},"relationship_source":{"type":"object"},"release_id":{"const":"release:art-expansion-batch-05-1.9.0"},"schema_version":{"const":"1.0.0"},"semantics":{"type":"object"},"starter_rotation":{"type":"object"},"theme_text_page_size":{"const":16},"theme_visual_artist_limit":{"const":16}},"required":["schema_version","release_id","algorithm"],"type":"object"}